content_1,content_2,content_3,content_4,content_5,content_6,content_7,content_8,content_9,content_10
@ryangrim @majorityfm The bad news is voter suppression and a massive overhaul of anti Bernie propaganda.,@jjtweet @ElijhaIsBlessed @BernieSanders A black Trump supporter who is fine with the voter suppression in CA and TX against minority voters? You can t be real,"realizing that most voters don t care about voter suppression, the DNC, rigging super delegates, real issues, senate voting history, or dementia.  They just want the Obama white dude  and that may be what we deserve","@RideOrDie7474 @internetaccoun5 @BernieSanders Yeah, the polls are unreliable. You should read about voter suppression in Texas though. Harder for poor people to vote. This isn't a coincidence","@FirstHonduras @axleblazeSA @michaelianblack Oh honey, I am WELL versed in voter suppression. Talk to anyone who volunteered or worked for the Abrams campaign in 18. No one on the left is scoffing at disenfranchisement. That doesn't explain the other states, or the demographic breakdowns.",.@BernieSanders is the best chance for biggest voter turnout against Republican voter suppression and Trump.  Trump won t debate Bernie. Trump can t run to the left of Bernie.  Trump will run to the left of Biden. Just like he did against HC.  #Bernie2020 https://t.co/kNdanIpAaU,"@Theophite @AtticusGF For some people, the census is a once every five years opportunity to get a little voter suppression in. They will probably want to go ahead with it.","#QAnon February news brought to you by Eye Drop Media and We (are the Real News now) the people. #DigitalSoldiersWorldwide override of Mockingbird Media fear, Panic, False Narrative. What are We Witnessing Patriots? Dark to Light #GreatAwakening  https://t.co/vxHoNkxZZ1  🇺🇸✝️🇺🇸 @MAJMO50 @Anthony87918622 @Tractor444 @RedDragonFly19 @QArmyInfo @XHawk80 @jandennis1955 @liltilgerlil @BPPope @Michaelcraddo16 @45HarisonHarold @robin_ked @PhilZantos @GregoryJHall1 @TheeSib @LizzyHock1963 @luvmypittys @bbl58 @QuincyA17 @macv58 @TresaBridges @WWG1WGA @lazyishhound @Shayarm @donnie_maga @DRottiemom @Jingoman111 @mbees39 @AmericAnon57 @ThoseCofers @Alphaa16147110 @TrumpCanuck @santori_lisa @VonYugen @kimbetech @sandykennedy55 @jakkedup1 @kiwisquaw @nscrowba @DebbieS00267284 @SpankyTheDog1 @Fairbanks357 @PunkyPaneteddo @jonathan_wcm @Lynnstueber @LadyRebel144 @DemonteAnna @realDonaldTrump @POTUS #WeAreTheNewsNow #Q #EyeOpenNews #EyeDropNews #FebruaryReview #SuperTuesday  #coronavirus 👁️💧📰 Quick review of February News. Music by @TrumpCanuck  💥💥💥💥💥💥💥💥💥 https://t.co/p7legSwXMf",@JoeNBC We need Bloomberg &amp; Steyer to:  Help stop voter suppression  Get voters to their voting place when suppression is happening  Blast the airwaves with anti tRump ads  Go on news shows &amp; show the voter suppression in real time  #VOTEBLUENOMATTERWHO up &amp; down the ballot,@KathyTu57558497 @tracyDa34033517 @JoeFreedomLove @AnthemRespect @Lrihendry huge company in Texas can make these very fast If one state just start this it would catch on Dems claim Republicans will cheat Republicans claim Dems will cheat Voter ID with thumb print and photo would stop voter fraud  #voterID  #voterIDnow https://t.co/Lj2hTaMJM8
"Voter Fraud an illegals Voting, That will be President Trump's Biggest Problem.. We have already seen what happened with Democrats in The First State.. I, for one, won't be happy if this election is tainted, by illegal votes, seditiously conspired against  or STOLEN from President Trump. I will then become the RESISTANCE... who joins me ?","friends if you live in the next states taht are voting PWEASEE bring snacks and a power bank charger, bring a speaker and play a movie bc if we get shit like texas and cali voter suppression the least we can be is prepareD",Is the CoronA virus just a voter suppression tactic? Find out next time on DBZ... en español,"@berniebroette @ninaturner @ChuckRocha They've done this garden variety voter suppression so much, many of us have just started to treat it as another hurdle that's baked in. But it is still deeply anti-democratic. Just another reason the whole system needs to be reset under #PresidentSanders",@largest_son @howdidwegether8 @chaotikphantom @elseedubya @RyBoy87 @MJDraperBlake @_marymary7 @ziibiing Right! The baked-in oppression of terrified white folks is enraging. Shame on Republicans for rigging elections via voter suppression and gerrymandering.  But this precludes people from early voting in states which allow it?,"Now that I have fully participated in this thing, let me now tell you why that thing sucks and should be destroyed Now that I m officially no longer an organizer, take it from me: The Iowa Caucuses are a quintessential example of voter suppression, plain and simple.   Not only should Iowa not go first, but the caucuses should be abolished",We need Bloomberg &amp; Steyer to:  Help stop voter suppression  Get voters to their voting place when suppression is happening  Blast the airwaves with anti tRump ads  Go on news shows &amp; show the voter suppression in real time  #VOTEBLUENOMATTERWHO up &amp; down the ballot Bloomberg is out  #SuperTuesdsy https://t.co/6bfCKbpvix,@washingtonpost Journalists need to seriously highlight what Texas has done to suppress voter turnout still further in Black and Latino areas. No other party in the democratic world engages in voter suppression  as its primary modus  operandi. https://t.co/cLbBD7hqnr,@NYinLA2121 Uhhhh ya I don't think Bernie agreed to have polling places in districts with rising black and latino populations either be closed or really backed up. Its called voter suppression. https://t.co/kGpA2omroP,god damn voter suppression!
"@llambchops CONTINUED  As to the issue of voter fraud...  I have long advocated to add voter fraud to the sedition statute and to punish it accordingly, to include the imposition of the death penalty.  A bus full of illegals going to vote illegally is a bus driving to the TDCJ death chamber!","#YM @LilTunechi As #BlackHistoryMonth comes to a close, it's important that we continue to recognize the challenges communities of color face in America.  That means speaking truth that voter suppression is real. White supremacy is real. Racial bias in our health care system is real.",NANCY BALLOT HARVESTED SUPER TUESDAY.................WHAT DO YOU THINK??? Are California voters stupid OR do we have a massive voter fraud and election integrity issue in this state? I ll discuss my findings on @foxandfriends in 10 mins. https://t.co/wRjlKeKI0A,"If I was a voter in one of the Texas voter suppression areas hit by closed polling sites or understaffed, undersupplied ones with hours long waits, I'd be looking for ACLU and/or pro bono help to investigate the potential for a lawsuit.   This undemocratic shit needs to end!","@JAllen_NY @DoryDoesTweets @neeratanden It wasn t rigged anymore than every other election is via voter suppression and long lines. So, in a sense, yes.",@alley167 @cq2101 @donnabrazile @FoxNews @GOPChairwoman @POTUS Trump never did anything about voter fraud. Biggest mistake ever!,"OMG. Some stupid lady on the news just said, waiting in line to vote is voter suppression.....are you for real?  Aye God",@JuliansRum @WillieWholeSlew Death Penalty for voter fraud!!! 👈 This ends all the bull shit!,Michael Bloomberg drop out and endorse Joe Biden. That means Democrats and fake White Caucasian news mainstream media is going to rigged election again against Bernie Sanders since 2016 with Hillary Clinton.  ~Baron Tremayne Caple/Fox Man/Fox Black/Baron Fox/Baron Tremayne Fox 🦊,@SKYRIDER4538 @EngagedPatriot @GaetaSusan @robreiner My money s on @HillaryClinton . These career politician @DNC criminals are indeed a cabal who could care less about election integrity.
"@TomiLahren Gee, in the interest of the phony ""fair &amp; balanced "" news be of Faux News how about interviewing the many voters who experienced attempts at voter suppression? You are so incredibly biased. No real reporting just party line regurgitation. Educate yourself. https://t.co/1iAEmJ0DH7",@ehillgarrett @PalmerReport She s doing more against voter suppression that anyone else in the history of our country. Give me a good reason for a no on Abrams.," At least until we win another rigged election; House, Senate and White House.","@DanRather Speaking of texas, would that have gone differently if without the voter suppression?","Democrats don't care about anyone. They only care about obtaining power. And with a Socialist like Bernie Sanders likely to be leading the party, only goes to show they're ok with the death of thousands if not more.  Could the coronavirus hit California's homeless? Health officials are worried.  / Now imagine if the Democrats in California had worried about their homeless citizens BEFORE this impending catastrophe. They were too busy courting illegal votes, of course. https://t.co/LNMVSXBLbl",@danb7983 @Becca4Bernie Trump supporters making light of systematic racism and voter suppression... Typical.,"Meanwhile in the U.S. @rplevy I don t care who it s good for, voter suppression is always bad","@BuddyWoodchips @gorcowbot @HermeusXerxes @OliviaJRowe @gaywonk @MaraWilson Seemingly many Bernie supporters r rigid in their black/white, condescending, certainty that your guy is the one and only or else, ... thinking.  You do you. But don't blame a B loss on ""establishment democrats"", ""neoliberal shills"", ""rigged election"", or other ignorant reasons.","@MoralReactions @TVietor08 @BernieSanders I m not claiming there wasn t voter suppression in Texas but it s mainly directed at black &amp; brown people. There were also huge lines in California, where Bernie won","@blue_irl @pom_eater @AmateurMmo @Danielle682013 @c23662 @blondjewels @angie_keathly @HawkkIts @BoneThumper @twitaintshit @Coffeeb32465973 Oh ,you're talking about standard Republican voter suppression. Only way you have a chance."
#oceverything #News #world_news #Top_News Study casting doubt on Bolivian election fraud triggers controversy  A study by Massachusetts Institute of Technology experts that called into question the alleged election fraud that drove Bolivian President Evo… https://t.co/63gjrdPCUX,"@wiczipedia Thanks for your analysis Nina. There are many ways to rig an election. Whether it's spreading misinformation, excluding candidates who disagree, not playing fairly with funds designated for the entire party, supplying misinformation to news outlets. It's not just ballot stuffing.","@KathTX No, it does not. Revolution is fine in theory, but there are far too many structural barriers to the people making his agenda happen. SCOTUS, the electoral college, voter suppression. Apathy.","Americans haven't been educated about civic's. (gov) in Pub.Ed.for the last 45 yrs. My parents born in 1918&amp;1921 with only HS educations knew how the gov. worked. They got more civic's ed. than I did in HS in the 1960s. In HS today there's almost 0. It's really voter suppression Rachel never asked once about the huge Latino vote, but asked about the lack of the Black vote. Neither is a monolith but the race is still young. The youth turned out but Many were locked out at the polls. That has gotta change quickly.","Not any more, dear. When racist voter suppression (522 polls closed without warning, all in poor, minority neighborhoods) is a Democratic Party tactic two cycles running, I can t be a Democrat any more than I can be a Trump Republican. The Clintonian  ape-the-GOP schtick=trash. #RiggedDNC is exactly the reason why @BernieSanders and some of his supporters are no better than trump.  Support your preferred candidate, but if/when they come up short, don t mimic trump claims of rigged elections.  Reminder - you re democrats, not republicans.",@realDonaldTrump We need Bloomberg &amp; Steyer to:  Help stop voter suppression  Get voters to their voting place when suppression is happening  Blast the airwaves with anti tRump ads  Go on news shows &amp; show the voter suppression in real time  #VOTEBLUENOMATTERWHO up &amp; down the ballot,@AngelaBelcamino Wow I really like your voter suppression dance,There's nothing the Democrats hate more than democracy. The Democratic party is trying to suppress the vote with Republicans. Democrats silence on this is deafening   Where is Stacy Abrams? Remember when she claimed she will fight voter suppression then she joined CAP?  https://t.co/X1uqY8g8iv,"@yangonomics @hionceagain @mwetzel7r @majesticalexis OP's point was even if it was a joke you're not supposed to make fun of voter suppression. But that doesn't characterize it, it's like saying a joke about enslaving white people is racist.",Funny how if you dig into the  voter suppression  stories just who and what money is behind that suppression.  But thanks for never having a complete news with facts story about it cnn it made the bullishit easier to ferret out.
@KareninCarolin1 @MichaelBurley @sandyHuggy @singerwithhorse @Lori51686859 @BrandonBeckham_ @realDonaldTrump Since when have Democrats ever cared about life? They are the party of death!! Any age. Any stage. Any reason. They kill babies in &amp; outside the womb. They are proponents for letting elders die. They fully embrace dead voters.,"@proustmalone @Zoemae31 Democrat vote period  Regardless of dem candidate otherwise why would you vote for trump???  No vote or third party vote with current voter suppression is a vote for trump   Which means rt wing supreme  court appointees,  all level of court judges If BS not elected he can work",#YoureDamnRightI get angry when I witness election fraud/engineering/whatever you want to call it to favor one candidate over another. That is the death rattle of democracy! @BernieSanders @davidsirota @briebriejoy,The Fake Polls have to make an accomodation for the fake votes. https://t.co/JGkjbh3qlm @bbusa617 Polls don't matter..but voter fraud does. This is concerning... https://t.co/E6TBBG5nHP,@janetracker @amjoyshow @MichaelSteele A Republican who chaired the party while the white supremacists and right-wing wackos were taking it over and a POC who chaired GOP Southern Strategy and voter suppression. But they cut taxes.,LOL he was probably voted for by the Cali Dems who moved there OR voter fraud?? How on the face of this earth did Bernie win Texas?😳😬😬,"@Gator__ No, because it's easy for a white guy like you in your socioeconomic position to go elsewhere, no one else has any excuse, right? That's not you tacitly enabling voter suppression or demonstrating privilege, just you telling less fortunate strangers what their reality is.","@SallyAlbright ""if there were no black people"" is why white politicians like voter suppression.","@FuctupMike makes good fodder for the fake news to push another smoke screen to block their guilt from the public eye...fake Russia, fake Ukraine, fake fake fake... virus is designed to disrupt 2020 election...another form of democratic voter fraud.","We can t get complacent we gotta VOTE I made a pledge I m taking 2 people with me. This is just as/more important than 2016 I truly think voter fraud and complacency are our biggest concern Well, @realDonaldTrump won #SuperTuesday. The numbers don't lie...  #IDoNotLikeJoeBiden @DonaldJTrumpJr @EricTrump @parscale @TeamTrump #TrumpWarRoom #MAGA2020 https://t.co/p5wxDghuuR"
"@AOC No way we have all those indictments for crimes against children and treason, election fraud, wire fraud ,embezzlement, stacked high!!! Death PENALTY stays. MILITARY TRIBUNALS FOR THE DEMON RATS. https://t.co/gL6xaY6VW6","Anyway, if you think I'm nuts, there's an HBO documentary from I believe 2006 that covers Black Box Voting, election fraud, and the Bush campaigns in 2000 and 2004.  This was a totally normal thing to discuss for non-ideologes/conservatives in the mid 2000's",@hero_ofdreamers Weren't those polling areas in black places? Isn't it more of a rehearsal for the usual black voter suppression?,twatomi the china made gun pouch pants is calling California voters stupid. #Twatomi Are California voters stupid OR do we have a massive voter fraud and election integrity issue in this state? I ll discuss my findings on @foxandfriends in 10 mins. https://t.co/wRjlKeKI0A,"Gut feeling: delegate chicanery, voter suppression will steal this from Bernie-but Biden won't make it to the general. I just don't see it-his faculties are declining fast. Trump voters who might've been inclined to switch will stick with Trump. Thanks @DNC you'll be two for two!",@BibleBeltDarlin Donna should be arrested and should be kept life Long in prison for this voter fraud cheating.,"🙏 for our country and President Trump.  My concern is voter fraud supported by the Democrats. Bernie Sanders supporters are upset the Democrats are stealing the nomination from him.  I have news for the Bernie supporters.  They are doing this because they know his plans and philosophy s are not just dangerous but unrealistic.  Don t worry, @realDonaldTrump will win!",@Harvard1988 @mzflea @MiaFarrow @realDonaldTrump Murder is the only form of voter suppression they haven t tried yet.,"@erindavis Another Trump election strategy. Sympathize with Bernie Bros about rigged elections which will cause lower turnout, not voting for Biden and better chance of Trump winning. I hope Bernie says something to his crowds.","@JohnCornyn Hey Senator, voting is a right that should be convenient and simple. The Republican party is well known for voter suppression."
"@John_Walton_ @Whatapityonyou @MSNBC Texas and the GOP are good at voter suppression. We already know that. Cali tho  the most progressive state in the country , - is just as bad. This is a coordinated bipartisan effort to keep the working class from participating in elections, plain and simple. 🤢🤮","What good sportmanship did Najib show? The counting and announcement of vote counts were dragged till 3-4 am last GE, voter fraud and all. Used the blackout method on GE13.   So cheating = sportmanship now? 😚👌🏼 PH people have poor sportsmanship; zero respect for the referee when the final whistle has been blown and game over. Former PM @NajibRazak is a gentleman who accepted GE14 results &amp; stepped aside. Can u imagine if Najib tried to keep voting to add more votes for BN in GE14?","Mike fought for voting rights when Republicans tried voter suppression tactics in #tx10 in 2018, and took time out of his campaign to fight for Rodney Reed, who Texas was wrongfully trying to put to death. We need more activists like Mike in Congress! https://t.co/MZHRoMV4ZA",wow voter suppression in a predominantly black neighborhood Poll workers in Dorchester say some voters are being asked to show IDs to access polling place. #MAPrimary #wcvb https://t.co/yrEKy12UhQ,@gtconway3d @realDonaldTrump Are you concerned that fox polls are rigged to cause voter suppression among dems by making them believe fox supporters don't believe trump will win? Creating a false narrative to placate voters and diminish need to vote?,"@jess_mc She thought it was sexist that people called Hillary out for doing the things men did, but better  I hated the men who did these things- voter suppression and supporting death for profit businesses. I supported one who hadn't  We never agreed, but we did come to understand(2/2)","@JoshuaEli23 @markbelmares @jimmy_dore @noreallyhowcome @MSNBC She's no threat to Bernie atm, and I don't mind having someone in the race to talk about election fraud, Assange, etc. if Bernie won't","@fdr_huey @progressvoice Oh yes, I agree with you re: the precedent. One such precedent might be declaring no term limits for president. He could increase voter suppression, particularly for POC. He could jail those who disagree with him. He could do anything. Unopposed power= the ultimate precedent.",Has Trump ever seen an election he didn't think was rigged? Paranoid charges of rigged elections is one of the Mobster Don's default conspiracy theories. Trump on Democratic primary: 'It's rigged against Bernie' https://t.co/pH41XS3JpV via @politico,@christofspieler This is voter suppression. Someone should be in prison for this
@Ehud1977 @RyanAFournier Okay. How about this; there are more people killed by falling coconuts every year than there are people committing voter fraud.,@RichardBurgon Oh rot. Your English's vote rigging...,"Russia, Comey, racism, and voter suppression had some things to say too Biden ain t it. I think the man is a great speech maker too, when he s not under pressure. But his platform is literally  We ll go back to how it used to be!   Y all,  how it used to be  is what got us Trump. I know people insist it was voter apathy/3rd Party voting, BEHT WHY THO","@taurl_ @Pseudosaurus @DrakeCarrington This stance is confusing given that Biden polls as well, if not better with many of the subgroups most heavily impacted by voter suppression (e.g., Black, working class White, etc.).","@CornellWBrooks a little voting fraud once again I'm sure...  well, the good news is that voters will end up with another tax break from 2020 going forward when @realDonaldTrump wins in a landslide https://t.co/vUhMfiUtB8",What is being done about ‘voter fraud  before the 2020 elections? Does anybody know? I m sure many of us would like to know... Voter Fraud. This is what we have to deal with. They will ramp it up ahead of Novembers election...670 Ballots Cast in Georgia Precinct with 276 Voters https://t.co/zIzQds0cOf via @BreitbartNews,@annalieCG @CHIZMAGA So you send me a probably liberal schools writing about voter suppression  as some proof of Russia interference?? How many Russians came here and voted in our elections??? How many Russian votes were found in 2016?,"@QasimRashid @LovenGrace58 You re a not telling the truth  @QasimRashid 🤥 No voter suppression, many poll workers didn t show up in Texas because of the fear of the corona virus. #FakeNews #StopTheFearMongering","@marceelias @TheDemocrats Lol @ voter suppression...  Another fake ass talking point from the Democrats.  Voting is easy. You register, you vote.","@hastyreaction @DarrickHamilton @shaunking Thanks for this. I am thinking of the rise of autocracy and increase in white nationalist terrorism, the new Jim Crow, increased voter suppression, Supreme court gutting of the voting rights act, etc. But, the statement I made should be more specific and less sweeping."
"@MamataOfficial has gone mad, she needs a bed in Dhaka Asylum! Please hurry up. Send her to Dhaka as all Indians in WB are Bangladeshi. @ihcdhaka @BangladeshGov please take good care of this old communist who killed all jobs in India for her illegal vote bank. @Republic_Bharat दीदी @MamataOfficial ,आदाब🙏 पाकिस्तान, सीरिया,ईराक़ में भी आपका बहुत बड़ा वोट बैंक है,उनको लाकर बंगाल में कब बसा रही हो ?? वोटों के लिये आप लोग देश को भी बेच दोगे",@MSignorile We need Bloomberg &amp; Steyer to:  Help stop voter suppression  Get voters to their voting place when suppression is happening  Blast the airwaves with anti tRump ads  Go on news shows &amp; show the voter suppression in real time  #VOTEBLUENOMATTERWHO up &amp; down the ballot,@RMpodol Last year 1500 political protesters were murdered by the Iranian government... if you want to talk about voter suppression,I'm a #SuperTuesday  voter! I'm voting for @JoeBiden here in Tennessee! Who are you voting for? Please put your state!,"If for some reason Trump loses. It s his own fault for not doing anything about voter fraud and voter ID s. It s a fact it habbened, because of Tom Fitton and nothing was done. Does anybody else find it curious that Joe Biden, who hadn't won a single primary over 3 presidential bids is now surging after Democrats engineered Pete Buttigieg and Amy Klobuchar's departure from the race? Joe was completely expected to win SC. But this is unprecedented.",@TXsecofstate You and your ilk are engaging in blatant voter suppression.  For shame.  Shame on you and all the people who helped do this.,"Civic duty is so unwoke. Who is doing this terrible voter suppression that made everyone, young and old, wait on lines all over Texas to vote in the Dem primary?","By having Obama and literally every other candidate and neolib hack intervene the day before Super Tuesday, along with voter suppression and VERY suspicious divergence of vote totals from exit polling, the DNC has entered its death ride aboard the Biden Express. The Bernie Brothers sounds like the name of a band that plays at boutique concert venues","@McArtichoke Truth be told, it's almost definite that she voted for him unless her Whip told her he'd win anyway.  Truth be told, her party's complicity in massive election fraud is tantamount to her voting many, many times for the old tsar. Nothing coy about these truths.",This could be a Republican voter suppression tweet.I see these all the time on progressive news sites don t be this fucking stupid https://t.co/zb2Tm75bRc
