content_1,content_2,content_3,content_4,content_5,content_6,content_7,content_8,content_9,content_10
@DLoesch @GOPChairwoman She doesn t mind profiting off of the  conspiracy  of a rigged election but you d better believe that she will still defend the integrity of her party! Then again I wouldn t want to be suicided either!,@PatriciaHeaton Its like the Russian hoax if you say enough people will panic. Yes I'm worried about  CORONA virus but I'm also worried about a Bernie Sanders in the white house. I don't think there's a chance But anything can happen with voter fraud.  So November vote #2020KAG,@marceline26293 @bwaymase voter suppression with the young people it s awful,"@fintancox @fiannafailparty The public do not want FF in government,they don't want ppl that propped up FG in government for the last 4 yrs and sat on the fence as FG ran health services into the ground, homeless figures broke records, and then the FF voting fraud in dail eireann.","The Untold Story of Super Tuesday... President Trump Trounces Vote Totals of All Past Incumbents in BLUE States!   @POTUS will be running against DNC voter fraud, not Joe or Bernie in November! https://t.co/4xz5nduBJI",Honestly probably a good way to do voter suppression on old people,@seanhannity Shouldn t think Trump is an easy win at all. Remember Hillary?  There will be so much voter fraud as well. But God willing Trump will win,"You don't have to worry! Trump is staying in the White House!! I believe that the Voters are  seeing how corrupt the Democratic party is, with their voter fraud and the high taxes in California and New York!! Socialism leads to Communism! Trump and the Republican Party 3020!!",@DeedsWylie @kweansmom the lines in texas were caused by voter suppression and closing polling sites. lines in cali caused by incompetence. and the bern did not win big in cali and he isnt bringing young people to the polls,"@TheInfamousMarv I know man! I don t know what the hells going on down there! I know cats are active on the scene down there! But it seems like every time there s voter suppression, someone didn t check on certain laws! All kinds of issues to impede the voting process!"
"@FOXLA At a polling center in Palms, LA the person who helped me couldn t even locate my voter registration information (I m a frequent voter) so I had to do a provisional ballot!  Terrible and voter suppression at that point",trump......WILL YOU SHUT THE FUCK UP!!!! This is OUR Democratic election not your russian rigged election!,@marthamaccallum What will you do to combat voter fraud? The ONLY thing that could defeat you.,"@ShpionRusskiy @VRKnyght @ChodesMcGoads @Slickhawk12 @shaunking Ok you're saying it's ok for the WHOLE @DNC to rarely if ever speak on it, for many many cable news appearances and press conferences to not get to it, but Stacy Abrams solo is the best effort against voter suppression and the @DNC isnt aiding by only false resistance? Lol sure",I believe that voter fraud should be punishable by death... Can you imagine teachers are showing illegals how to vote illegally they should be arrested you can see their faces where is the law https://t.co/eNW7qdnuUI,@WalshFreedom Also massive voter suppression in college districts in states like Texas. And a huge percent are in college out of state which depending on the state doesn t allow you to vote,"I want a study on Bolivian dude s toupee fraud. Someone told him that looked good on his head, and I want to know who! Study casting doubt on Bolivian election fraud triggers controversy https://t.co/DIs1VdYjvy https://t.co/jPMyKn7QK0",@ByrneT03 It s called voter suppression. They make it difficult for poor and non-white people to vote.,"There should be NO projections OR results reported until the very last polling place in the country is closed.... This is called voter suppression (election meddling). @FoxNews pulled this same shit during midterms... @realDonaldTrump Joe Biden wins Democratic presidential primary in North Carolina, Fox News projects via FOX NEWS","@TamanishaJohn @LovesTheBern The DNC has been flexing their voter suppression muscles HARD in SC, IA, CA, TX...  They re practically begging for the Green Party to get a threshold that makes them competitive in 2024."
#VoterFraud perpetrated by the #Democrats Are California voters stupid OR do we have a massive voter fraud and election integrity issue in this state? I ll discuss my findings on @foxandfriends in 10 mins. https://t.co/wRjlKeKI0A,Anybody else sick to death of Muslim Council of Britain? Who brought voter fraud into UK - Labour Asian (ie Muslim ) boroughs look at Tower Hamlets or Oldham - grooming trafficking gangs &amp; terrorists attacks we ve had  two since New Year just in UK alone try some humility,@NikkiSchwab This is what voter suppression looks like. Head out to the lily white suburbs where all the boomers vote... I guarantee you won't see lines like this.,"Holy shit.. If anyone knows of any bi-partisan reports on voter suppression over the years I'm really interested in how things like this end up happening because it's just not acceptable Texas voter says he waited ""a little bit over six hours"" to vote on Super Tuesday https://t.co/EJDToYtJnh https://t.co/4w639ixx4z",We need to make obvious changes to the election process.  - Limit money in politics - Nomination by popular vote - Ranked choice voting - End gerrymandering - Stop voter suppression - White people can't vote ever again,"@realDonaldTrump ""The Democrat establishment"" is going to kick your vulgar imbecile ass out of the White House in November, jack. And it'll be overwhelming so forget any stupid notions about claiming ""voter fraud"" and staying put.",@marclamonthill Closing polling stations in majority minority neighborhoods makes voter suppression in the Democratic Party very real!!,Every time there s a shooting Democrats call for gun control. Why don t they call for voter ID every time there s voter fraud.,@PalmerReport Stacey Abrams a 77 yr old s death away from the presidency?  I don t think so.  She s done a lot for voter suppression but isn t ready for the presidency.   Lots of qualified options.  More likely Warren to unify far left and moderates.,"@davidsess @thicklipjenner Gen-X &amp; Millennial AA's are down ballot voting &amp; staying home strategically if no black agenda is met. They have been ignored, called bots, accused of voter suppression because they asked for reciprocity. They have been presented with class-based generic policies over specificity"
@HildaSolis Hilda Solis oddly quiet on the voter suppression that took place in LA County last night.,"point of someone like Bernie running then if you want him to be like a standard Dem who tokenizes POC, women, LGBTQ. Furthermore, fucking accept that you will not win every demographic or region. And way to ignore the DNC shenanigans and mass voter suppression. It s people like",Oh please that has not been your sentiment! This. That's all we're saying.   From one of the most respected voices in the nation on election integrity. https://t.co/TntfvDawmC,@yopasta @LACountyRRCC If @AlexPadilla4CA is guilty of intentional voter suppression should he go to prison?,Because they are cheating! Every time there s a shooting Democrats call for gun control. Why don t they call for voter ID every time there s voter fraud.,"@RealCandaceO @BLEXIT Republicans depend on voter suppression and non-voters, so it makes sense that a red state would make it so difficult and discouraging to vote. They do this in black areas and this is a proof that Republican party is not for blacks","@democratsrduhm @seanhannity it has been researched to death; just didn't happen, and why would all the illegal votes only be for one party? anyway, bye bye","I don t think I will ever understand what makes Biden so attractive to black voters Sooooo...Biden wins TX and pulls within 10 in CA.   @TheDemocrats voter suppression tactics, along with their constant, corrupt targeting of @BernieSanders on behalf of their wealthy donors seems to be succeeding...but only for now.   The party is conspiring to steal the race.","@US_Conspiracies As Trump has proven over and over again, he was well prepared ahead of the Covid-19 thing and I am sure that behind the scenes he has prepared for the obvious voter fraud the DemocRATs have planned for Nov. 2020","SIZE OF CROWD: #1 truth never seen on fake news MSM DNC ""news"" refuses to show the crowds at TRUMP rallys. I have seen every single speech of TRUMP FOR YEARS on ""unbiased"" CSPAN never once did corrupt fake news MSM DNC show the actual crowds. because MSM DNC is a fraud. #Biden can t get 50 people to show up. The amount of voter fraud it will take to steal the presidency from @realDonaldTrump is unprecedented in the annals of #Democrat chicanery. https://t.co/eKTej69pIq"
@Jonathan_K_Cook This is what America stands for a fraudulent media and Pompeo promoted fake 'election fraud' campaign resulting in President Evo Morales being ousted by fascist US backed military. Israel welcomed by US backed regime. @Apintie @RanaGaza @magic10fm @surinamenews @MaddowApp,"@StacyAbrams wants to be @VP, but remains silent over something as egregious as this?  And, poor @NeeraTanden is so distraught over minorities not being able to vote, she remains completely silent as well. The Democratic party is trying to suppress the vote with Republicans. Democrats silence on this is deafening   Where is Stacy Abrams? Remember when she claimed she will fight voter suppression then she joined CAP?  https://t.co/X1uqY8g8iv","@mehdirhasan You re ignoring anti-Clinton energy that helped Bernie then, voter suppression, sexism, Russian intervention, populist nationalist candidates prevailing in many countries as anti-immigration response, the historical unlikelihood of a party getting 3rd term, sexism, media fails...","@legitngnews Former INEC CHAIRMAN 🤣🤣🤣..Baba this is not a case of ballot box or election rigging, Please rest sir.","We need a long-term strategy and focus on local, grassroots, and deep infrastructural change. The entire system just won't allow the changes that need to happen: money in politics, voter suppression &amp; disenfranchisement, gerrymandering, et al. 365 days, not once every four years.",Illegal aliens vote. Are California voters stupid OR do we have a massive voter fraud and election integrity issue in this state? I ll discuss my findings on @foxandfriends in 10 mins. https://t.co/wRjlKeKI0A,@BWithFreedom @SkoczSteven Okay so voter suppression is fake then right?,"who the fuck does bloomberg think he is showing up at a historically black church to do a political speech  Bloomberg addressed the congregation... in which he discussed voter suppression and the fight for civil rights. But roughly 10 minutes into his remarks, several in attendance rose from their seats and silently turned away from him.  #NotTodaySatan   https://t.co/O4tKb6IvbD","This is voter intimidation. Peruse my threads for 100s of neoliberals using voter intimidation tactics.   I've been abused, insulted and told to fuck off and kill myself for stating that since I am not a Democrat I will never vote for Biden.   #VoterSuppression   @MarkRuffalo @fvkntk @teddy_cat1 @DavidAgStone @BrenMCO @ProudResister @JoeBiden @BernieSanders This isn t just about 4 more years with the moron in the White House. His erosion of the institution, undermining of the free press and use of DoJ and senate as partisan tools erode the fabric of the republic. But hey, we re all Trump supporters to you right?","@MsAvaArmstrong Shaking my head at this, since Michigan has enough illegal voters already!   But, it's not Summertime in Martha Vineyards, so lets mingle with the little people."
"More rethuglican voter suppression: Analysis  confirms what many activists have suspected: the places where the black and Latinx population is growing by the largest numbers have experienced the vast majority of the state's poll site closures.  https://t.co/2Hua0ppAPD Texans, don't be sidelined by the GOP's attempts to suppress, cheat &amp; steal. Be overcomers. VOTE ANYWAY. There's too much at stake not to.   https://t.co/9C413wOT2p","They still don't have the rights of white people, I am a white man from the south and I've seen it up close and it is one of the reasons that my wife and I moved out, Sunday, Bloody Sunday  State-sanctioned violence in response to Black people marching to end voter suppression.   Marchers did not attack back so that who the oppressor was would be evident.   They had a goal.   We re grateful.  #VotingRightsAct #RestoreTheVRA #Selma #Selma55 https://t.co/Evi5QzFNbA",Nicki stans shouldn t be able vote if I m being quite honest we should put the voter suppression laws they did to Black people to Nicki stans,"55 years ago today, nonviolent civil rights activists including my friend @repjohnlewis  were violently attacked as they marched against segregation and voter suppression.   Today and every day we are grateful for the sacrifices they made in the fight for equality.    #Selma55",@RBReich We need Bloomberg &amp; Steyer to:  Help stop voter suppression  Get voters to their voting place when suppression is happening  Blast the airwaves with anti tRump ads  Go on news shows &amp; show the voter suppression in real time  #VOTEBLUENOMATTERWHO up &amp; down the ballot,@realDonaldTrump STICK IT TO THEM!! What about those that were issued Drivers Licenses?! When will Voter ID become Federal Law?! When will voter fraud be punishable by death?!,@MSNBC We need Bloomberg &amp; Steyer to:  Help stop voter suppression  Get voters to their voting place when suppression is happening  Blast the airwaves with anti tRump ads  Go on news shows &amp; show the voter suppression in real time  #VOTEBLUENOMATTERWHO up &amp; down the ballot,"I believe there is a lot of voter fraud in CA I don t trust the elections.Through DMV many non citizens were registered to vote and I believe they vote!That, along with vote harvesting have made a mockery of CA voting. California Republicans Lead in 6 of 7 Districts Lost to Democrats in 2018 https://t.co/9eLhZGqY07 via @BreitbartNews","The GOP is an irrelevant and obsolete group of old, omniscient and arrogant white men who feel their station in life is to obtain obedience from others while counseling them on their behavior. They were a perfect mark for nefarious activity instigated by oligarchs.  #FuckThemAll. Top Trump adviser: Republicans have 'always' relied on voter suppression https://t.co/pC6d68k2z8","the reason texas goes so fucking hard on voter suppression btw is because they know the moment they dont conservative politics in this state are good as dead, the only conservative people in texas are politicians"
@dodgybint @descobar91 @TheCheekyGinger @decaro_nick Gross. Repellent in every conceivable way... all the way down to the racist voter suppression.,@arden_messing @JoeBiden Closing polling stations in majority minority neighborhoods makes voter suppression in the Democratic Party very real!!,"If it was ever about turnout it's this year. It's about ""this time your country needs you"" to everyone we meet in every place we meet them. And then make polling lines fun and comfortable. With childcare. Don't let the line itself be voter suppression. #TeamWarren","@RepAdamSchiff Oh Adam, one more time! Going to blame someone/something else once again! This time it s the polls closing to  control  votes! How about the lack of voter ID, hmmm wouldn t want those illegal voters stopped would we? This guy could have voted by mail weeks before, but didn t!","@cmclymer This guy acting like voter suppression is only affecting Bernie. It s Texas. Every dem in that line was getting screwed and dems in power have been fighting against rigged elections for decades. As usual, berners can t see anything but Bernie being wronged.",voter suppression is the worst - won't let me request my mail in ballot in peace. Luckily I'll be in town - so I got time.,💥💥💥Boom💥💥💥👇🏼👇🏼👇🏼 https://t.co/4lcrUNho1T Every time there s a shooting Democrats call for gun control. Why don t they call for voter ID every time there s voter fraud.,@hiygay @fernseasons Ofc there was also voter suppression in Texas which really hurt minority communities. Some people had to wait in line 4+hrs to vote on Tuesday.,@Throwaway21_ @PALNUD10 @EdgeofSports What do you think brought us Trump? What follows a do-nothing Democratic administration? IMO it'll be something worse than Trump. So you do your big picture and leave me out of it.  And it's a good thing the DNC doesn't engage in voter suppression.,"@val_tigress @robittybobnob @MailOnline Zara also stole her seat, voter fraud https://t.co/Cloctm1GBI"
Xormedeso Belbera became the professor of the isolated manse through egregious voter fraud. They went on to enact bubbling laws and build a regime of slaughter that would last for centuries before falling to sadistic defeat.,"@JulieSmithM I understand and I believe that Maddow is wrong many times including when talking about Iowa but she's right on this one. Super Tuesday was bad because of youth turnout, whether it be voter suppression or not, people didn't go to the polls and that's a problem.",@syl20carle @CanadianGreens @CBCNews I would add that the report is missing an investigation into election fraud. #FakeNews #DefundCBC   Reminder: A free press is essential to keep corruption at bay. It s a pillar of our Parlimentary democracy.  Has anyone noticed #PPC peeps are Canada s news now?  #WeAreTheNewsNow https://t.co/xY0LS6M2SK,"@wholesomeBhris If you are able to vote and choose not to that s not a political action that s being inactive. So many movements were born because many believed that voting is a right not a privilege and yet in 2020 MANY PEOPLE still can t vote cause of voter suppression,etc.",are we surprised? like at all? provisional ballots are the most low key method of voter suppression BREAKING: Machine Malfunctioning Forces East LA Voters to Vote Provisionally. https://t.co/1KOa6fLQVp,@SamuelJohnWhit1 @GOPChairwoman @realDonaldTrump They want the illegal votes which they are encouraging.  It isn't going to help them.,@tifinblm @pookietooth @akvawe66 @Penguin_SYLS @imvala @medwoman1 @PersevereEver @miss_simone247 @Markholiday13 @PoliticsPot @DonnaShank10 @newsjunky2 @MenVoters @gorillastyle @niggafactory @SeanTDel @fitts_dr @zaharias19 @Jeanetteisback @crookedpinkie1 @Counselor70 @ThereseOSulliv2 @GoofyGary7 @RedArmyQ17Trump @BuilderGuard @BMcCodeOvets125 @MManselle @20bluetsunami20 @ParonoidThe @KaMac76 @CunningMarshal @QuidRises @annableigh @dandavisdandavi @HouseOfJames2 @dam0n_n0mad @yooper3215 @Grandma_Boom @grimm_resist @camp_terrence @KelliPenney @TrumpSugar @calijeff1 @SpaceForceBravo @LauraGramm @Skinsnrugby @BobC7000 @JLinMiller @GhostRollo @gonehunting1776 Meth labs are a thing. In-person voter fraud is a myth.   Please vaccinate your children.,"@r_wolfcastle And then the next time the Democrats register ineligible voters, like the dead in Chicago, jail time!  Which, of course, is why neither party will pass such legislation.",@tressiemcphd @MeganMunroe4 @Spelmanite88 I think you are mistaken to see this as an argument that black voters are at fault. Black voters did not create voter suppression. Black voters did not direct Russian disinformation. Black voters were not responsible for HRC campaign's failure to do reach out to elevate turnout.,"The GOP has no bounds when it comes to voter suppression and they ll use the virus as a tool to help Trump stay in office for sure. This thread shows some of the things I believe they ve already been planning and how the DNC should prepare (THREAD) I see many stories on the Coronavirus, many on the election, a few on the politics of the Coronavirus, and virtually nothing on how the Coronavirus could interrupt election season. Isn't that a conversation analysts should at least *begin*? I try to do so in this thread. https://t.co/sNFJaKMYGP"
@davidsirota Closing polling stations in majority minority neighborhoods makes voter suppression in the Democratic Party very real!!,No ID no voting! I wonder how many dead people vote on Tuesday in California?  Voter Fraud!  Must be stoppedd Are California voters stupid OR do we have a massive voter fraud and election integrity issue in this state? I ll discuss my findings on @foxandfriends in 10 mins. https://t.co/wRjlKeKI0A,"Oh MY, I love this so much. Even if they steal this election through voter suppression, DNC or convention maneuvers, No one can stop this movement. #BernieSanders2020 Minneapolis, Minnesota   https://t.co/tgCYnMycoe",@KavanaghW17 @DonCheadle The only way Republicans win is by voter suppression. Still missing the whole point of the tweet because Trump supporters don t like facts.,"@davidmweissman Part of the voter suppression efforts that have been going on for years, but are ramped up more and more every year.",https://t.co/RK98sKv7h0 send pizza to the polls and please help fight voter suppression,"@abe1776 https://t.co/SxhuSZcO7e active voter suppression is the real reason Mr Abraham Jackson, they were closing polling places at 11am on super Tuesday here, and this is the guy  you want? Two veterans confronted @JoeBiden about his record of supporting war during his campaign stopover in Oakland on Super Tuesday. Read more here- https://t.co/ushpLvVXK5 #DroptheMIC #NoMoreWar #VetsAgainstWar https://t.co/M7iGZa7DOs","@bbennett310 @ananavarro Hahaha okay bro..... how many hours have you volunteered, how many new voters have you personally registered, how many marches and protest have to done against voter suppression?",@DonCheadle But I thought @RealCandaceO &amp; the other Black fake conservative hustlers said voter suppression was a Democratic myth.,"@nhannahjones I live in a wealthy, white area. I was in n out in 10 minutes max. This is a form of discrimination and voter suppression..and why I vote blue."
"4. I refer to them as angels of death, for a reason.  The guilty always confess, especially in moments of great stress...like this.  https://t.co/sC3YumiflO  National Nurses aka acorn moonlighting as... 🎶visiting Angels... America s home for... voter fraud 🎶  cc @POTUS check OH https://t.co/YVhahFKq44",@DonaldJTrumpJr Because Demoncrats want illegal voters.  😒 They can't win any other way. 🔴,"@Analilia_Mejia @AlexPadilla4CA @LACountyRRCC @Rafael_Navar @BernieSanders It s not a bug but a feature, hang in there against voter suppression!","@Kiltsnbagpipes @Ser_Zatarra @FriendOfTheYeti @BernieSanders There was active voter suppression going on in LA county and in working class neighborhoods in Texas yesterday, but your kind doesn't give a shit about that.   7 hour line on a university campus and you're gonna pretend that young people just didn't show up?","We should have begged HRC to run again. BEGGED HER.  She won the popular vote by 2.9M and lost EC vote by only 79,316 votes across three states.  After 4 yrs of Trump we coulda flipped 79,317 voters to HRC no problem.  What the fuck are we doing?","@guycecil @palfriendpatine Seeing these photos of the ridiculous lines at US polls makes me sick. It is voter suppression, plain and simple. The last time I voted here in Aus, it took less than 30 minutes including travel time. Americans deserve better. Indigenous/Black/Latino voices must be heard.","@marthamaccallum What is his plan to limit voter fraud in the 2020 election? Fine if he doesn t want to share the details, but let us know he has it under control...",@marthamaccallum I am extremely concerned with voter fraud and dirty voter rolls. Illegals are being automatically registered to vote through the DMV and many states do not have to show an ID or proof of citizenship to vote! What is being done to prevent this?,"@Nate_Cohn Two questions:  1. Who did the new, white voters primarily vote for?  2. Was black turnout flat because of GOP voter suppression?","OH shit -Here we go again, Republican voter suppression! Texas closes hundreds of polling sites, making it harder for minorities to vote https://t.co/SFUEaV6Lts"
