content_1,content_2,content_3,content_4,content_5,content_6,content_7,content_8,content_9,content_10
I'm a mailman in california and I can't wait to do voter fraud and make thousands of people vote for Bernie❤️,We need Bloomberg &amp; Steyer to:  Help stop voter suppression  Get voters to their voting place when suppression is happening  Blast the airwaves with anti tRump ads  Go on news shows &amp; show the voter suppression in real time  #VOTEBLUENOMATTERWHO up &amp; down the ballot Bloomberg drops out https://t.co/foIh7arg95,@ArifIPromise @babaosamie @TulsiGabbard We need election integrity Who has legislation for that? (Tulsi)  We need to fight climate destruction Who has legislation for that? (Tulsi)  We need to stop WW3 and make peace.  Who wants to bring leaders together? (Tulsi) Who hasnt repeated CIA TP? (Tulsi),@berniebroette @Nudiustertian2 @ewarren @maddow PS- report the shit out of this. It s a death threat and political voter suppression,"@joncoopertweets @BernieSanders  Too many black voters?  berners want black voter suppression, just like trumpers. Talk about birds of a feather.   #bernieEqualstrump","@whachumacallsit @VickiVictrola @RastaRafikii @GuptaThoughts @sweeptehleg @GravelInstitute By voter suppression you mean how red states gerrymandered the districts to death so the GOP would remain in power, right? Because accusing the  establishment  of an old man yelling at clouds not being able to convince moderates to vote for him is another Russian talking point.","Between them and illegals you can be assured the 2020 election will have massive voter fraud. POTUS needs to sign an executive order for only written votes, if not both sides are going to claim victory and we'll have another 4yrs of hussy fits from the left I wonder how many dead people voted Democrat tonight? 🤔","Why do @TheDemocrats @DNC pretend that we actually get a say? They just rigged election, it's impossible that @JoeBiden got that many votes! @realDonaldTrump #M4A #Rigged #RiggedElection #CorruptDemocrats #CorruptDNC #BernieOrBust #BernieSanders #Bernie2020 #BernieBros #BernieBro https://t.co/QOJz3DuBh2","Justice Roberts has slowly been reducing democracy. Corporations are people, there are no signs of voter suppression anymore and it s ok to gerrymander. This is a Supreme Court that protects our constitution and liberty ? No way. It s a capitalist corporation https://t.co/nExkoOFUk4 Justice Roberts objects to Schumer's statement against 2 right-wing justices Quiet as a FUCKING church mouse about Trump*'s attacks on 2 liberal justices No more talk about him being fair That fucks in on the coup OR he's scared of Trump* which makes him a pussy ass bitch LMFAO","Fox Entertainment, not news, is promotion immigration fraud, so tRump can declare election fraud.  The fraud was disproved four yrs. ago, you are fear mongering at it's worst, FOX idiots.  Never news, only fear."
"The 15th Amendment was designed to protect citizens from being denied the right to vote. Despite attempts at voter suppression in Texas, Hervis &amp; his wife would NOT be denied. I salute you both! @maddow Completely unacceptable. This is what voter suppression looks like. We are long overdue for a modern-day Voting Rights Act.",@GarrettHaake There is no voter suppression. The local Harris County DNC office determines how many voter booths are located at each polling location. These voters were failed by their own party. Remember Iowa?,@Jennyjen867 @RONCRAIN54 Voter fraud in the form of illegal aliens &amp; the dead voting are the biggest threats to our elections. We should have systems in place when a certified death certificate is authorized your name come off the voting rolls immediately. Voter IDS will minimize the illegal vote.,"This is voter intimidation. Peruse my threads for 100s of neoliberals using voter intimidation tactics.   I've been abused, insulted and told to fuck off and kill myself for stating that since I am not a Democrat I will never vote for Biden.   #VoterSuppression   @ACLU @fvkntk @teddy_cat1 @DavidAgStone @BrenMCO @ProudResister @JoeBiden @BernieSanders This isn t just about 4 more years with the moron in the White House. His erosion of the institution, undermining of the free press and use of DoJ and senate as partisan tools erode the fabric of the republic. But hey, we re all Trump supporters to you right?","I agree! Voters in Black areas were subject 2 voter suppression while voters at the highest voting poll, the Met, didn t have 2 wait a quarter of that time &amp; were treated 2 snacks &amp; water while they waited! I m a witness! It s hell 2 be a Black voter in Harris County! Forcing people to wait in line for 7 hours to vote is essentially imposing a poll tax as it requires workers to take off the entire day to exercise their constitutional right. I d be curious how many voters in wealthy, white areas had to wait this long.",@RacerGuy13 I d like to see a security team wheelchair Trump out of the White House as he screaming  rigged election! ,@SnarkyMi @colliver_jim @KamalaHarris 🤣🤣🤣Long lines are not voter suppression no matter how many times you post the crap headline from @cnn. We had extremely long lines in the Democrat supermajority of California.,@ScottWalker @JoeBiden The guy who went on a fake search for non existent illegal voters thinks he has something worthwhile to say🙄,"@RantsByDesign @FoxyLeftist @ProudResister Thank you for your replies. While I'm aware of voter suppression in many arenas and by many methods, I wasn't aware of how much this impacted voter turnout among the younger crowd.  We're in a heck of a predicament, and much activism is required.","@Fox_Newds @ibrahimpols @matthewstoller Trump didn't win. Gerrymandering, voter suppression, fraud and the manipulation of social media won."
y all calling america land of the free when voter suppression is RIGHT THERE,"@JulieReichwein1 If Sanders makes it into the White House, voter fraud will be the culprit","Lines like what we saw in Texas and California last night are 100% voter suppression. Polling places closing in neighborhoods that are predominantly poor, PoC, or young (e.g. College campuses) is an intentional act to favor DNC establishment candidates like Biden","#p2 #tlot #resisters #voteblue #uniteblue #democrats2020 #fbr #nevertrump #bluewave2020 #biden2020 #bidenharris2020 #ridenwithbiden @dnc @thedemocrats   NO #RiggedPrimary it's Trump trying to #CheattoWin again Don't fall for the Russian propaganda hashtag #RiggedPrimary.  It was created by Russian bots &amp; Trump supporters to make Democrats question the DNC and election integrity.  The GOP will do anything to win, and that includes working with Russia on stupid hashtags.",@SheaSerrano Texas has a REALLY bad voter suppression problem.  It's probably the only reason that Ted Cruz is still a senator.,What is being done about ‘voter fraud  before the 2020 elections? Does anybody know? I m sure many of us would like to know... https://t.co/Y4fsuXMleq Voter Fraud. This is what we have to deal with. They will ramp it up ahead of Novembers election...670 Ballots Cast in Georgia Precinct with 276 Voters https://t.co/zIzQds0cOf via @BreitbartNews,@Klynn2u I know. I do believe that s their plan though. I don t believe Biden can / will beat President Trump but... voter fraud scares me.,@eryno They used to say voter fraud in CA was rampant and I didn't believe.. until I found out that you don't have to present ID at any moment. You could get some illegals at the local corner and pay them to go vote for whoever your candidate is as long as you have a voter roll.,@theblaze What a joke!! Build the wall! Demon rats want illegal voters!,"@artmobley My response is for ice to round them up and ship them back out of here, trumper's do not need the illegal vote I want them out of here"
@leslieleeiii The best thing to me is all the blue checks suddenly remembering voter suppression in the South every 4 years,"@rhondajc51 @bighoss2b @DrIbram @SandraRumanek1 Shut up, white supremacist. You advocate for voter suppression so don t say anything about the  establishment .","@edwardyoung21 @jamacia813 @lee_banas @ladyred1956 @pkthornton1 @Louisianistan @TerryAnn1219 @busbee_deborah @Idclair @myawesomelife4 @elder_jodi @greene0049 @rjaviervasquez @d1Vinman @fda_i @jakalpimp @atDavidHoffman @DharmaBum62 @billybobsgumb02 @DenGarman2 @Brimshack @DwightMarshal19 @DarinColville @BudGothmog44 @BetoMetroDos @JodeneRdc @NE_Bill1 Yes, but I think many of votes were manipulated by stoking racism, false info and voter suppression.",Ol fuzzy head is one big fraud Damn Bernie. You re fu€king telling people to commit voter fraud.,@keithboykin Republican plan of attack is voter suppression America! The results of this is how you get a Trump or a Bush in the White House and a Kavanugh on the Supreme Court.,"This isn't commitment. This is Republican voter suppression in Texas to keep power and ignore the will of the voters.   We have to flip Texas blue this November and we will. #SuperTuesdayResults  https://t.co/JzVJZAgtDn MSNBC reporting that young people have been standing online for up to three hours in Austin, TX, to vote...and haven't made up their mind about who they are voting for. That's commitment to the concept.",Vote registration insanity Are California voters stupid OR do we have a massive voter fraud and election integrity issue in this state? I ll discuss my findings on @foxandfriends in 10 mins. https://t.co/wRjlKeKI0A,"This is voter intimidation!  How do we protect people that could be putting their lives on the line in order to vote? Pioneer City County Museum Director: 'I hope every single one . . . that votes republican, dies today' #InspiredBySchumer https://t.co/wWTORVmjO7","@JohnRLottJr @Richard16562000 @RepThomasMassie The answer to how many is ""not that many,"" but an economist has to look at cost v. benefit. How many cases of voter fraud can an ID requirement prevent?  Even less. Cure in search of disease.","Everyone makes mistakes. Most of those mistakes do not necessitate voter suppression, nor any of the other ills we impose upon the exiled.  If the punishment is not death, then we should be supporting life. Prison reform is a necessary part of our social progress toward justice. Whatever happens from here, I ll always be grateful to Bernie for being the only candidate with a policy platform that includes the right to vote for incarcerated ppl.  I spend a lot of time w/folks in prison &amp; know how much this means to them. It s made them feel less invisible."
Every 4 years u hear about voter suppression but magically nothing happens about it,@RossHannah5 @BernieSanders He's divisive...and defensive. Listen to his speech from today. Listen to his speech from yesterday The powers in the democratic party have not United against him. There is no conspiracy theory...no rigged election. Only Bernie supporters not voting in the numbers he would like.,Speak out against unjust actions by our justice departments. How many years of your life is equal to voting after receiving intentionally unclear information.?  Court date set soon for appeal of Tarrant County woman s illegal voting ... https://t.co/CryndSBb69 via @YouTube,"Ok, Tomi give President Trump a call and have him watch your video. Are California voters stupid OR do we have a massive voter fraud and election integrity issue in this state? I ll discuss my findings on @foxandfriends in 10 mins. https://t.co/wRjlKeKI0A",Supporting illegal votes! Could someone explain to me why this wasn t a 9-0 decision?   Why on earth would you not be allowed to prosecute people for stealing IDs?,"It's fucking gross that churches (who don't contribute to our tax base) are where so many of us vote in Oklahoma. It's wrong on so many levels. As a queer person, I wouldn't be welcome in the place I cast a ballot. I consider it to be a voter suppression tactic","Let's see how much of the voting % of the Black electorate changed from 2016.  Also, Sanders actually increased his share of the Black vote, and won young Black voters.  This was simple voter suppression and the Obama machine working the polls. The Bernie crowd wants to snow you into thinking the Biden surge is some K street conspiracy when in reality he has barely advertised because his campaign is so underresourced.   What really happened is black voters gave Joe Biden the popular vote lead because they trust him https://t.co/GOKKYrWZkI",@Deb_Rosenthal @RavMABAY It's clear you are a horrible person who cares only about yourself. Latin children dying in cages is ok. Blacks suffering under voter suppression is ok? White liberals are so fake. Racism always comes out when they can't have their way. Your sense of entitlement is embarrassing. https://t.co/NCDGdffStK,Yep @NaveenB93714582 @Kick_Back_Relax Changes like this are a NOT normal. Dead giveaway for election fraud in any sane country. A recount must be demanded,"Good thing racism and voter suppression are a thing of the past (sarcasm). #RememberInNovember https://t.co/6PGgcFUwXN If only there were some obvious thing that happened in 2013   a #SCOTUS decision, perhaps   that made it easier for states like Texas to make it much harder for members of certain demographic groups to vote... https://t.co/yxCIuUoV7Z"
More voter fraud from democrats!  When is this going to be stopped??! Why is Texas turning purple?  https://t.co/wEQ3JO2uU2,"Republicans depend on voter suppression and non-voters, so it makes sense that a red state would make it so difficult and discouraging to vote. They do this in black areas and this is a proof that Republican party is not for blacks","@soledadobrien Oh so true. In Texas, voter suppression is the GOP s battle cry. #GOTV. #VoteBlueNoMatterWho2020",Cable news cares more about minor Russian bot farms on twitter than voter suppression and rigging in the US. The official vote counts from the Massachusetts Democratic primary differed significantly from the exit poll  Sanders won in the exit poll and lost in the computer count  Discrepancies between Sanders and Biden totaled 8.2%  double the 4.0% margin of error https://t.co/HQha3GAfJu,"@gritsygirl1 @MoskKim @StayWonked @ewarren @JoeBiden Good god-core values? What, like guns for all, voter suppression and incompetent judges? They have you fooled","@radzcat @wamitami @Makemyday59 @mywindsun @emilycheath Voter suppression of who?!!! They are all Democrat voters! And typically voter suppression affects black voters.. Who go predominantly to Biden. Bernie WAS front runner, then SV and it changed...","@editorrobin @wkamaubell It looks like Bloomberg hurt Biden more than voter suppression in Texas. Biden is probably going to win Texas, but it's going to be a draw when it comes to delegates.",@VanJones68 @JoeBiden Who was involved in the election rigging this time....Soros?....DNC?....Obama? All of them? There is no way Biden could have won when no one shows up at this rallies.,"@AndyDoubleYoo She didn't win due to large scale election fraud, I think we all know that at this point. It's a moot point to talk about Hillary ""losing"" the election because it was rigged. It was overly rigged to death and she still won the popular vote by damn near 4 million.","@realDannyRay @hexsal8 @capitaltigers @GeraldoRivera And who s party is famous for gerrymandering districts, purging voter rolls, closing polling stations and full on voter suppression? Don t come at me with fake news. The enquirer = fake news, not news that you don t agree with. 🖕🏼"
It never ends. Calculated white supremacist voter suppression. The majority-black city blocked from electing Black officials  https://t.co/l0oyX0VLRc,"@Thomas1774Paine Yeah, but try to purge those even with a death certificate presented and they will say it's voter suppression. It will be interesting to see whether any of those signed absentee ballots since they died. #Election2020",@Salacia_sea @JasonSCampbell @IngrahamAngle She s a Fox News host and a white woman (I m a white woman too). Our polling places wouldn t be closed to prevent us from voting as a form of voter suppression. Laura is a racist &amp; a horrible person. Do it s not surprising she s h My she s horrible comments like this one.,"The @GOP loves to make noise about voter fraud--which is make believe--however, both they and the @DNC have no problem restricting/suppressing the vote for certain populations. #BurnItAllDown Long lines at polling places in Texas' Black and Latino communities on Super Tuesday have already impacted the November election. https://t.co/exmx7Rdkhw via @HuffPostPol",@esaagar @krystalball Closing polling stations in majority minority neighborhoods makes voter suppression in the Democratic Party very real!!,"There s this thing about Democrats, that is that we love losing. Even more so if we can lose on a golden platter, we really like to play the  rigged election  card. Gets a lot of virtue points for everybody",@Garythesnail889 @markbealmear @hollyotterbein lol it's like you didn't even read the 14 conditions. TN is a GOP supermajority state. they do voter suppression and make it as difficult as possible to vote. they only want old white people voting.,"So now , racist-white man hating, terrorist supporting communist @AOC want to abolish the death penalty.  Soon as you #liberals agree to abolish #SanctuaryCities, #DACA, catch-release. and voter fraud #conservatives will 'consider it.'  🇺🇸 #Trump2020 #MAGA #KAG2020 Abolish the death penalty. https://t.co/qePaBAPXcI","@VodkaMuse Going full fascism because he's suspending the election due to coronavirus pandemic and/or because of ""serious concerns with election fraud by the democrat party"".   OR  The coronavirus mutates and we go full ""28 Days Later"".","@RealJamesWoods @HillaryClinton lost to an political novice who had zero accomplishments in the political environment/arena. Now @POTUS has many, many, many accomplishments as President, so Clinton will beat him now?  I think not unless there s massive, massive voter fraud."
@TheRickWilson Republican voter suppression? Please! That's about as ridiculous as white men and Christians in America saying they're persecuted.,"It is BEYOND time to do something about this Mr, BARR.   Is the whole point to have voter fraud In The election to get Trump out, then dems go along with the deep state AGAIN? Breaking: FBI agents in Carter Page probe barred from FISA court requests https://t.co/EP9io3jwQF","Be sure to vote! 🇺🇸  And here's some useful tips for #SuperTuesday: @kenolin1 @JoeBiden @BernieSanders Pick the one who was never a deadbeat dad, didn t honeymoon in the USSR, would never be mistaken for a socialist and who didn t write rape fantasies. And oh yeah, didn t waste 30 years in the Senate naming post offices.",@RaniaKhalek Let's not ignore closed polls and election fraud. I'm sure sooner or later we'll find out what happened via leaks.,Pot calls kettle black. Are California voters stupid OR do we have a massive voter fraud and election integrity issue in this state? I ll discuss my findings on @foxandfriends in 10 mins. https://t.co/wRjlKeKI0A,@TomiLahren Find another platform that is stating there is voter fraud and I might believe it. According to the federal government there really isn't any. Prove there is and source your proof with something besides Faux News.,"the amount of ratfucking and voter suppression tonight has further convinced me, it's bernie or bust baby. I'm writing his fucking name in if you don't give me a choice and there are gonna be a shit ton of people like me. Have fun in hellworld, I'm already living in it","@bennwalton @MichaelSonsino @JLSLFK @KristinaRenee @jfreewright @EdgeofSports And I have been reading some younger Progressives asking  How is Biden better than Trump?  Well, he doesn t represent the party that uses voter suppression as a cornerstone of its strategy, for one thing.","@JohnCornyn Heh, I voted early in Georgia Texas' inspiration for voter suppression in 2016 and waited 2 hours. Learned my lesson. When I vote early, my polling station is in a heavily black area (South DeKalb Gallery), when I vote day of, I'm in my rich white suburb (Decatur). 10min wait.",@oldmancoyote22 @TenaciousE5 @magi_jay @unpersuaded112 @johninsc1 I m not the  democrat  advocating for voter suppression because I don t like who that person is going to vote for.
@TomFitton Thank you so much! The value of our votes in California is greatly diminished by multiple layers of voter fraud and corruption that have decided elections for decades. Comparing voter roles with birth/death records could fix much of it. Why hasn't it been done?,The only reason #RiggedPrimary should be trending is in a discussion of the voter suppression among black and latino voters. And that was all done by Trump and the supreme court.,Why are citizens waiting hours to vote? Is this voter suppression! Do better America!  @MSNBC @CNN  @ABC @NBC @FOX @CBS,"Harris County has done more harm than good the past few years of their  election overhaul  by compromising with groups that do not deserve the gig of overseeing citizens in the first place, some that have since been FIRED for their work towards voter suppression","@AlanLLee @RealTimBlack I m good with Bernie but that really could be considered pre-meditated election fraud, no?",@angela_rye You probably want to give dead voters more credit,Poor guy only had weeks of early voting. It's just not enough time! Completely unacceptable. This is what voter suppression looks like. We are long overdue for a modern-day Voting Rights Act.,🔥🔥🔥 @esaagar @krystalball Closing polling stations in majority minority neighborhoods makes voter suppression in the Democratic Party very real!!,@promexico @gholachu @riotwomennn @RalphNader I'm very well aware of voter suppression. I witnessed it first hand voting in Texas on Tuesday. This last one benefitted biden,@ems1944 @rmc031 So you recognize that voter suppression exists but don't think it factors in to people not voting because ...?
"Good thing racism and voter suppression are a thing of the past (sarcasm). #RememberInNovember If only there were some obvious thing that happened in 2013   a #SCOTUS decision, perhaps   that made it easier for states like Texas to make it much harder for members of certain demographic groups to vote...","@dbongino @jeeper64060 2/ ...stories from the Jussie hoax to the tarmac meeting to election fraud in FLA all came from local outlets. If the NYT or WaPo political reporters had gotten an exclusive on any of these stories, you can bet they would ve been buried. Many of us local scribes hate that crap.",thank you so much Crystal for telling us your truth and real voter suppression Crystal Mason: Arrested for Casting Provisional Ballot https://t.co/VqAgJbvGbZ via @YouTube,@KHOLMESlive @NBCLA This is what voter suppression looks like.  Hang in there folks,💥💥💥Boom💥💥💥👇🏼👇🏼👇🏼 Every time there s a shooting Democrats call for gun control. Why don t they call for voter ID every time there s voter fraud.,@KamalaHarris Those dead voters are slow movers.,"Sanders needs the establishment to see him as a credible leader of the party. Running against the party (and all the anti-DNC/ rigged election  flames from surrogates) makes moderates worry that if he s the candidate, he ll be fighting Trump at a huge disadvantage.",@RevDrBarber White people are never affect by voter suppression don't include them in this,"America be vigilant. While Trump pretends to deal with coronavirus, surrogates continue plotting voter suppression, Russian interference, limiting personal rights, take over of US judicial system.","@Sultaan_of_A @ZaidJilani If there was any election rigging it was against Biden.  He got a majority of black votes in every state, and historically black neighborhoods are the ones that had the worst polling places and took up to 7 hours to cast a vote.  Bernie only has himself and his message to blame."
