content_1,content_2,content_3,content_4,content_5,content_6,content_7,content_8,content_9,content_10
"@NamvetSurvivor yes, he is just a vote getter. others would rule thru him.. and the only way that guy could win is with massive voter fraud.","@axanner Death threats, blackmailing (mostly using women like Prepaid Shiuna), character assassination, defamation, bribery, corruption and vote rigging are the tools by which MDP has got where they are now. @MDPSecretariat @MohamedNasheed","That's a tough one, because a lot are, and I don't know how many aren't. #(stupid.) Are California voters stupid OR do we have a massive voter fraud and election integrity issue in this state? I ll discuss my findings on @foxandfriends in 10 mins. https://t.co/wRjlKeKI0A","@TeamTrump Ca is committing voter fraud in so many ways here. Trump on R ballot only,must ask for R ballot to vote for Trump, changing voters reg party, leaving R s off down ballot s, to name a few things. More R s here Trump voters","@advancedflea Did he though? 3 million votes less than Clinton. And that's with Russian help and serious voter suppression. I'm not anti-Trump. I'm just anti-asshole, anti- narcissist, anti-corruption, anti-corruption, anti-anti-science, anti-pussy grabber, etc. He just fits them all.","Agreed. I have EVERYTHING Bernie stands for. But this election rigging by the Democratics must be stopped. I LOATH Bernie &amp; his supporters but what the DNC is doing to them goes beyond the pale of what any foreign government interference could ever do. They make the Russians look like AMATEURS!  Hang it up Bernie Bros &amp; save your $$ it's over, if u don't know that by now you're fools.",@cattinks @en_volve That s some crxx.  Every county in Virginia could NOT have gone to Biden. No way. There are definite red counties.  This had to be voter fraud!!!!!,".@NatSecReporter .@Greg_Palast .@mcrispinmiller .@BevHarrisWrites 👀 Anyway, if you think I'm nuts, there's an HBO documentary from I believe 2006 that covers Black Box Voting, election fraud, and the Bush campaigns in 2000 and 2004.  This was a totally normal thing to discuss for non-ideologes/conservatives in the mid 2000's",@kimalex3 Definitely time to point fingers. Especially considering Logan and the LA Board of Supervisors were warned this would cause mass voter suppression.,"@MsCBBoots @hyper_cubed I could swear the impotus in chief launched a whole commission into rampant voter fraud. Oh yeah, he did, and guess what? It got shut down cuz they found there was no widespread fraud they could prove. Conservatives only win if they cheat"
how in the hell is this legal? GOP voter suppression Long lines at polling places in Texas' Black and Latino communities on Super Tuesday have already impacted the November election. https://t.co/MueR8O2HCw via @HuffPostPol,@KyleKulinski Biden is a fake candidate with fake support running on a fake narrative. He hasn't held 1 rally or filled 1 stadium of supporters yet we are to believe he's winning? Blatant election fraud. Nothing Sanders does matters if we can't call out this fraud.,"nope, I registered twice and my name wasn t on the list where I was suppose to vote. I feel like it may have been some form of voter suppression @_liano no tf u not a register voter did u vote last time? If u did then ur still registered",Did voter fraud help Dems win seats in 2018 ? If so how will voter fraud be eliminated in 2020 ? Better be working hard now to stop ! GREAT NEWS!!     California Republicans Lead in 6 of 7 Districts Lost to Democrats in 2018 https://t.co/3EerSkNxfb via @BreitbartNews,"This is voter intimidation. Peruse my threads for 100s of neoliberals using voter intimidation tactics.   I've been abused, insulted and told to fuck off and kill myself for stating that since I am not a Democrat I will never vote for Biden.   #VoterSuppression   @ACLU https://t.co/J2NOAxZ3cP @fvkntk @teddy_cat1 @DavidAgStone @BrenMCO @ProudResister @JoeBiden @BernieSanders This isn t just about 4 more years with the moron in the White House. His erosion of the institution, undermining of the free press and use of DoJ and senate as partisan tools erode the fabric of the republic. But hey, we re all Trump supporters to you right?","@coords1306 @ezraklein By off the rails you mean allowing a white supremacist dictator to complete the transition to a right wing federal judiciary, voter suppression, and control over women and their bodies? If this election is about Bernie vs the Democrats that s the problem. He s doomed.","@plazynoodles Voting in general is not useless but with the state it's in in America with voter suppression, delegates doing their own thing no matter what etc... I get how they can feel their voting system makes it useless for them to vote","@MaggieJordanACN @BernieSanders Only the most privileged white folk would believe that there wasn t voter suppression against young people, poor people, and people of color","Why do @TheDemocrats @DNC pretend that we actually have get a say? They just rigged election, it's impossible that @JoeBiden got that many votes. @realDonaldTrump #Rigged #RiggedElection #CorruptDemocrats #CorruptDNC #BernieOrBust #BernieSanders #Bernie2020 #BernieBros #BernieBro https://t.co/8qFuAmKAai","White supremacist: voter suppression is ""non existent"" [sic].  Me: Here's several academic papers providing dispositive evidence to the contrary. Voter suppression exists and is harmful.  White supremacist: https://t.co/VaoimfQFdO @rdsathene @GOB3S @DrJillStein Hardly a peace that should be cited as an authority. The proof of the fact that what you say is utter nonsense are the millions of minorities clamoring to enter the US legally or otherwise."
@nicfschwarz @trask_spencer @dougslaton @jessicsm He s only getting the Black vote because we think white voters will go for him. But he can screw that up by not being enough of an alternative for white voters and not addressing voter suppression.,"@Kris_Sacrebleu Oh yeah, voter suppression is still alive and well in Texas. A take one damn guess why.","yes, obviously the real voter fraud problem is undocumented people with fake ID - oh wait, another Republican fucking with voter records? I m SHOCKED A Florida woman has been arrested for changing the voter registration of 119 Democratic voters to Republican or no affiliation.   https://t.co/76bxT1jRKz via @politicususa",@00_newton @1GreatFisher @Ilhan What's sick is the fact that she is in Congress. It has to be voter fraud,@IslandGirlPRV Just like they found no evidence of voter fraud back in 2010 when he maliciously prosecuted these black voters.  https://t.co/3PtjQh9Fur,"@buddhafl Yup voter suppression bullshit, and she still thinks she won the GA gubernatorial race lmao","@BVayna @TheNewThinkerr @BenjaminPDixon Yes. That's what Bernie's camp have been working on. Honestly, I don't think anything wrong with the campaign's efforts. I believe voter suppression and election fraud are at play.",reminder that the united states government is the largest terrorist organization on earth so don t feel guilty for committing voter fraud. ¡now get out there and let ur voice be heard legally or not! :D,@pam_sands @Scotus Dimocrats want the illegal votes. They need them to win by cheating.,"You realize the only folks that have an election was rigged when it was over have been democrats. #RiggedDNC is exactly the reason why @BernieSanders and some of his supporters are no better than trump.  Support your preferred candidate, but if/when they come up short, don t mimic trump claims of rigged elections.  Reminder - you re democrats, not republicans."
"@thedailybeast I enjoyed the vid, because she's calling republicans out for hypocrisy... The problem is she admitted democrats rigged election against bernie in 2016...  Oh, well.  😐","this is called voter suppression. how many folx have the time, energy or inclination to participate in civic duty + liberty when the govt infringes on such but only in Black communities and/or communities of color. #VoterSuppression This is seriously screwed up.  It shouldn t take anyone seven hours to vote in the United States of America.","Justice Roberts has slowly been reducing democracy. Corporations are people, there are no signs of voter suppression anymore and it s ok to gerrymander. This is a Supreme Court that protects our constitution and liberty ? No way. It s a capitalist corporation Justice Roberts objects to Schumer's statement against 2 right-wing justices Quiet as a FUCKING church mouse about Trump*'s attacks on 2 liberal justices No more talk about him being fair That fucks in on the coup OR he's scared of Trump* which makes him a pussy ass bitch LMFAO",And all of this is a recipe for leveling accusations of  you rigged the system against us  at the people who the system is actually rigged against. You have white men indirectly accusing women of color of voter suppression and election rigging. /11,@coalminds @HKrassenstein Closing polling stations in majority minority neighborhoods makes voter suppression in the Democratic Party very real!!,"If you don't believe that Trump has the most dedicated supporters...  ""Estimates each letter to be about 250 feet.""  😂🤩 Such a WISCONSIN Story: President Trump support carved into Lake Winnebago ice https://t.co/MYRvhfIEtY #maga #wiright #SuperTuesday https://t.co/qoWiKH60ak","@michelleehrman Gotta love that good, good voter suppression.","Rampant voter suppression, a la 2016. This is part of how the DNC rigged it for Hillary's coronation and we have no reason to believe they wouldn't do the same for Biden. Last night terrible for progressive movement, but blame game targeting ""others,"" like young voters who didn't vote, the ""establishment,"" corporate media seems problematic, avoids any responsibility. Who/what do YOU think is ""to blame"" for what happened last night?",.@BernieSanders is the best chance for biggest voter turnout against Republican voter suppression and Trump.  Trump will not want to debate Bernie. Trump can t run to the left of Bernie.  But Trump will easily run to the left of Biden. Just like Trump did against HC  #Bernie2020,i dont believe Biden has any legitimate large amount of support... i believe most his votes r fake... i really hope people r not dismissin how big a problem election fraud is where democrats have the opportunity to do so...  this issue could determine the next election......
"It s not about #joeBiden vs #BernieSanders vs #Trump, it s really about voter suppression.  Stand up and vote these people out!  #latinoguide #latinopolitics #latino #latinx. https://t.co/9GVco9mJ4Q # via @HuffPostPol",@intersectionalx Yeaaa I have fam that lives in Texas and Louisiana. 😞 Local Governmental schemes for voter suppression are ridiculous. Finding the exact place to vote was so confusing my last vote in LA.,"Hold on isn t that what Democrats pursued? that trump won a  rigged  election by Russia haha what rigged election did trump lose that his followers got mad about again?? #RiggedDNC is exactly the reason why @BernieSanders and some of his supporters are no better than trump.  Support your preferred candidate, but if/when they come up short, don t mimic trump claims of rigged elections.  Reminder - you re democrats, not republicans.","More rethuglican voter suppression: Analysis  confirms what many activists have suspected: the places where the black and Latinx population is growing by the largest numbers have experienced the vast majority of the state s poll site closures.  Texans, don't be sidelined by the GOP's attempts to suppress, cheat &amp; steal. Be overcomers. VOTE ANYWAY. There's too much at stake not to.   https://t.co/9C413wOT2p",@Athebeach12 @jennycohn1 @BetteMidler @VoteTexas @Taniel Texas is really good at dishonesty and criminality in ejections and bitter voter suppression . It s The Heart of Texas  /- in politics which is literally a blood sport,A lot of these laws relating to bodily autonomy and voter suppression schemes will come before federal judges and then the SCOTUS in the next year or two. Who do you want appointing them? If you can't figure this out or are unwilling to you are VERY complicit in this mess.,"@SallyAlbright @ezrateach He's crying ""election rigging"". That's not new.  It's been the battle cry since 2016 of both Sanders as well as his 'brother from another mother' .... Donald Trump.","@briebriejoy @thecatsmeow0410 And that's even with the closing of polls locations, dropping people off the rolls, vote flipping and forcing people to vote via provisional ballots. #Bernie2020 #PresidentSanders","@wiczipedia These are all fair points.  But what would you call intentional voter suppression, by doing things like redistricting and closing most polling places in majority non-white areas, but not in white areas?  That's still absolutely systemically meddling in the electoral process.","Rachel, if you report @shaunking to @twitter support it will carry more weight. This isn t freedom of speech, it s election manipulation by spreading lies. What?  No. I didn t report any such thing."
"@Tore_says Been saying that for a year already... he's the easiest to remove leaving her as president - that is, if they win.   Hope you and @Millie__Weaver continue to follow up on the election fraud info you sent to everyone and their brother!","@kevinjbrown65 @WanderlustOld Nothing but election cheating by Democrats, but they call Republicans racist for wanting Voter ID!! They call it voter suppression, all while canceling out legal votes by Democrat illegal votes!! Who is really guilty of voter suppression??? Nice one Kevin!!!","No crowd Trump rallies, and phone voting fraud. Virus really hurts Trump. 5G and Virus weaponized.  WAR ROOM (2nd HOUR) Mon - 3/2/20 • Cyrus Parsa, News, Calls, Reports &amp; Analysis • Infowars https://t.co/fhfTTUHbXl #BitChute",@DoTheLocalThing Aren t you ashamed to be a Black man advocating for voter suppression. Embarrassing.   Oh and by the way I m more politically aligned with Warren aka the voter y all out here begging for.,"@DylanJCross92 @JordanChariton @BernieSanders Plus Bernie probably has much more support than we even know bc of #electionfraud and voter suppression. I think he likely won Massachusetts and would have won Texas, for starters. I hope the campaign is pursueing these results.",Abrams is incredibly smart and capable. @ehillgarrett @PalmerReport She s doing more against voter suppression that anyone else in the history of our country. Give me a good reason for a no on Abrams.,"It's gonna get worse...Republican Trumpists are teriffic at voter suppression and all things Machiavellian. Everyone needs to hound Republican governors in states where voter suppression occurs regularly, like Texas, Georgia, N. Carolina...you know who you are, like @GovAbbott. Texas voter had to wait in line for nearly seven hours until he was able to cast his ballot.   He finally managed to vote at 1:30 a.m. and then told reporters that he was heading straight to his night shift at work, which he was already late for. https://t.co/6QKrEjtD77",@KyleKulinski @TomSteyer  can u please 🙏🙏 put your money into lawyers to fight this. And other attempts at voter suppression,@JuliansRum @Olga22481803 Keep voter fraud to a minimum..Which is difficult there I think Trump does have a chance in CA,"@rip_wheeler @BeamRobbie @OregonGovBrown I prefer more reputable sources like the late OR SoS Dennis Richardson who, before his death, issued his finding that voter fraud is exceedingly rare in OR and that he discovered ZERO incidents of non citizens voting. My eyes are open but they are not clouded."
Get u someone who will commit voter fraud with you. That s true friendship. 😤😤 @achaoticone Finally a tru friend,"Suddenly they don t like police harassment, but they still love the voter suppression","@Bernie2020WH @progressvoice HRC won by 3M votes. Only reason she lost Penn, Wis, and Mich is third party votes, and voter suppression.  Each of those states were lost by less than 1% well under the # of 3rd party votes for Stein, etc, write in votes for BS, and straight up votes for T by BS supporters.","Mass Incarceration,  voter suppression? LA just became Mississippi. No offense meant Mississippi. In the last 5 years, the LA DA s office has sent more people to death row than the states of Georgia, Louisiana, Mississippi, Tennessee and Virginia combined.","@Howyabeen1 I do believe that because it would give them the advantage. Literally the same people like Bernie, was saying strong borders years ago. Now it s open borders for them. And it s not voter suppression if it s affecting both sides.",@ACLU This is great but could you guys please help the american people sue for voter suppression in various states? Its absolutely racist and disastrous for all of our rights!,One of the many things what s wrong with California Are California voters stupid OR do we have a massive voter fraud and election integrity issue in this state? I ll discuss my findings on @foxandfriends in 10 mins. https://t.co/wRjlKeKI0A,@jaketapper Because he know's the establishment like you will try to rig it for him. News flash if it's rigged Trump will win for sure  because millions won't vote in a rigged election.,@Willie700WLW Republicans like voter suppression  https://t.co/ju9cHXG613 Your #SuperTuesday reminder that Mitch McConnell and Senate Republicans blocked a bill (HR 1) to enact automatic voter registration and make Election Day a holiday.  It really shows how scared to death they are of the American people actually having a say in our democracy.,"For Abrams, create an oversight position-have her oversee FEC! @ehillgarrett @PalmerReport She s doing more against voter suppression that anyone else in the history of our country. Give me a good reason for a no on Abrams."
"When a handgun license is an acceptable form of voter identification but a student ID is not, voter suppression is the only explanation. If Republicans are so sure they have a winning agenda, they need to let people vote. https://t.co/QvYR6iM0ZQ","also, the turnout of new voters for Biden was higher than Bernie. the youth vote was down for Bernie in many states from '16. there's still voter suppression all over the place and none of that takes into account party shenanigans.","The Bernie or bust and voter suppression trends are idiots parroting MAGA and Russian interference. They ve learned nothing. This makes me even less likely to support Bernie. If he gets the nom, I m out. I ll vote against Trump, but I m out. Fuck Bernie &amp; Fuck Trump.",A seven hour wait to vote is de facto voter suppression The last voter at Texas Southern University has walked out of the voting booth. It took Hervis Rogers nearly 7 hours to vote tonight. #supertuesday2020 https://t.co/kEQ0HgPZHg,@jdcapelouto @ASFleischman Why do these GOP idiots believe this fucking narrative of voter fraud and how the russians arent helping trump.  The Fuck is wrong with them?,"Many #USPeople were not fooled by Obama. In 2007-2008 many USPeople warned USA that O uses felony Illegal USGov IDs &amp; O is a USEnemy who works w/ USEnemies to destroy &amp; overthrow USGov,USMilitary,USTreasury,USBiz's &amp; USPeople.O got in office bc of voter fraud &amp; ballot count fraud Obama USED us! Obama FOOLED us.  He used his color to get the black vote and he forgot all about us.  President @realDonaldTrump has done so much for the black community! I m starting to think he s black!  LETS GET A DNA TEST DONE!  Thank you Mr. President https://t.co/O7jKYbhilA","@BarbMcQuade @NormEisen Yes, kudos. Now please kick Dem leadership to impeach again. Your country depends on it. Also open investigations into election security and voter suppression.",@SandersAlabama @Salem4Congress The Dem establishment has no problem with voter suppression as long as it suppresses poor people turn out.,"@ZabbiaA @BernieSanders My sincere hope is that the toxic, anti-Democratic and anti-American voter suppression party, the GOP, will get flushed after a big loss in 2020, and the Democratic Party will splinter into the Progressives/Greens and the Donkeys (Old Dems). . .",@TheMittani so is voter suppression of Black people but they turned out.
"@TeamPelosi @YNB Madam Speaker, we need to fix the voter suppression that very long lines like those in Texas and California represent. Before November. By court orders if necessary. Please.","Stacey Abram has started a ""get out the black votes"" and working to get gerrymandered lines redrawn, and voter suppression fixed. This is after losing the governor vote in 2018. I believe in Georgia. @PalmerReport Kamala VP Schiff AG Steyer EPA No Bernie  I don't know Stacey Abrams' strong suits. We don't hear her name very much, here in New England. 🤔","Those who suspect voter fraud of any kind should call the United States Attorney s Office at 225-389-0443, or call 225-955-8283 if the suspected fraud occurs on Election Day during polling hours. I teach juniors in a public school district in a state that, by law, has to accept any student regardless of citizenship.   Many of my students will be able to vote this year &amp; a day Is scheduled for them to register. All they need is thier school ID. What can I do about this? https://t.co/RghMDMM5Kq",Donald Trump going to prison will be a more globally celebrated event than the death of Osama bin Laden.   Let's ensure that outcome. Stay on top of your voter registration as the GOP is all in on voter suppression.  https://t.co/YTRisv0l9n,Someone needs to sue Texas for voter suppression and California for incompetence.,"@urbanevol I wonder how many black voters not able to vote for many reasons - voter suppression,  no access to voting, no time etc. This must be common in all states. But if they do come out, I think it will be different in SC @snappysparrowmh what do u think?",Mitch McConnell's Do-Nothing Republicans have blocked:   A fair impeachment trial  A SCOTUS nominee  Democracy legislation  Clean energy investments  Gun control  A $15 minimum wage  #SuperTuesday seems like a good day to remind you that we can also vote them out in November. https://t.co/3utHLLRmXo,"@olusogaowoeye So it is Okay if the person is your benefactor? The other person too is a source of income to others. Let them keep playing each other until the true yorubas who love their people  come forth ,Not all those who glamorise thuggery,election rigging,playing of ethnic cards etc",@marceelias We need Bloomberg &amp; Steyer to:  Help stop voter suppression  Get voters to their voting place when suppression is happening  Blast the airwaves with anti tRump ads  Go on news shows &amp; show the voter suppression in real time  #VOTEBLUENOMATTERWHO up &amp; down the ballot,@chrislhayes @AnaKasparian This is so Texas - it ll be blue soon enough and voter suppression efforts will fade
